[
  {
    "id": "person.nwei.cuihao",
    "uuid": "b75c2382-6c4f-40bb-a603-4f1b2e1cf5ef",
    "name": "崔浩",
    "name_traditional": "崔浩",
    "titles": [
      "东郡公"
    ],
    "courtesy_name": "伯渊",
    "category": [
      "chancellor"
    ],
    "dynasty": "dynasty.northern-wei",
    "birth": null,
    "death": {
      "year": 450,
      "circa": false,
      "original": "太平真君十一年国史之狱被杀",
      "disputed": []
    },
    "reign": null,
    "family": {
      "father": null,
      "mother": null,
      "spouses": [],
      "children": []
    },
    "predecessor": null,
    "successor": null,
    "bio": "清河崔氏，北魏第一谋臣。料事如神，助太武帝灭夏、北燕、北凉，统一北方。因《国记》直书拓跋早期史事触怒太武，国史之狱被族诛，清河崔氏、范阳卢氏等高门数百人连坐",
    "events": [],
    "artifacts": [],
    "wikidata": null,
    "sources": [
      {
        "title": "魏书·崔浩传",
        "type": "primary",
        "ref": "卷三十五"
      }
    ],
    "_meta": {
      "created_by": "ai-pipeline",
      "model": "kimi-k3",
      "prompt_version": "ministers-v1",
      "version": 1
    }
  }
]