[
  {
    "id": "person.wei.caocao",
    "uuid": "bd66336e-99cc-433c-b54b-419bbf8ac929",
    "name": "曹操",
    "name_traditional": "曹操",
    "titles": ["魏武帝（追尊）", "魏王", "曹孟德"],
    "courtesy_name": "孟德",
    "category": ["monarch"],
    "dynasty": "dynasty.wei",
    "birth": {"year": 155, "circa": false, "original": "永寿元年生", "disputed": []},
    "death": {"year": 220, "circa": false, "original": "建安二十五年正月庚子，薨于洛阳，年六十六", "disputed": []},
    "reign": {"start": 216, "end": 220, "note": "216年进爵魏王；终汉臣之身，曹丕称帝后追尊魏武帝"},
    "family": {"father": null, "mother": null, "spouses": [], "children": ["person.wei.caopi"]},
    "predecessor": null,
    "successor": "person.wei.caopi",
    "bio": "沛国谯县人，东汉末政治家、军事家、诗人。起兵讨董卓，迎汉献帝于许县，挟天子以令诸侯。官渡之战破袁绍统一北方，赤壁败于孙刘联军后三分天下成定局。建安中进魏公、魏王，加九锡，为曹魏实际奠基者。文学上与曹丕曹植并称三曹，开建安风骨。",
    "events": ["event.wei.guandu", "event.wei.chibi"],
    "artifacts": [],
    "wikidata": null,
    "sources": [{"title": "三国志·魏书·武帝纪", "type": "primary", "ref": "卷一"}],
    "_meta": {"created_by": "ai-pipeline", "model": "kimi-k3", "prompt_version": "weijin-v1", "version": 1}
  },
  {
    "id": "person.wei.caopi",
    "uuid": "20f96e9b-1973-4c01-898d-d4ed457cc03f",
    "name": "曹丕",
    "name_traditional": "曹丕",
    "titles": ["魏文帝", "高祖文皇帝"],
    "courtesy_name": "子桓",
    "category": ["emperor"],
    "dynasty": "dynasty.wei",
    "birth": {"year": 187, "circa": false, "original": "中平四年冬生于谯", "disputed": []},
    "death": {"year": 226, "circa": false, "original": "黄初七年五月丙辰，崩于洛阳嘉福殿，年四十", "disputed": []},
    "reign": {"start": 220, "end": 226, "note": "延康元年十月受汉献帝禅，改元黄初"},
    "family": {"father": "person.wei.caocao", "mother": null, "spouses": [], "children": ["person.wei.caorui"]},
    "predecessor": null,
    "successor": "person.wei.caorui",
    "bio": "曹操次子，曹魏开国皇帝。受汉禅建立魏朝，行九品中正制，三伐东吴无功。文学成就高，《典论·论文》为中国最早的文学批评专论，《燕歌行》为现存最早的完整七言诗。",
    "events": [],
    "artifacts": [],
    "wikidata": null,
    "sources": [{"title": "三国志·魏书·文帝纪", "type": "primary", "ref": "卷二"}],
    "_meta": {"created_by": "ai-pipeline", "model": "kimi-k3", "prompt_version": "weijin-v1", "version": 1}
  },
  {
    "id": "person.wei.caorui",
    "uuid": "d12984fa-88c6-4d4e-a276-56cb5e8563d2",
    "name": "曹叡",
    "name_traditional": "曹叡",
    "titles": ["魏明帝", "烈祖明皇帝"],
    "courtesy_name": "元仲",
    "category": ["emperor"],
    "dynasty": "dynasty.wei",
    "birth": {"year": 206, "circa": true, "original": "建安年间生", "disputed": [{"year": 204, "source": "据母甄氏归曹时间推算的另一说"}]},
    "death": {"year": 239, "circa": false, "original": "景初三年正月丁亥，崩于嘉福殿", "disputed": []},
    "reign": {"start": 226, "end": 239},
    "family": {"father": "person.wei.caopi", "mother": null, "spouses": [], "children": []},
    "predecessor": "person.wei.caopi",
    "successor": "person.wei.caofang",
    "bio": "曹丕之子，母甄氏。在位期间屡次抵御诸葛亮北伐与东吴进攻，曹真、司马懿先后掌兵。晚期大兴土木营宫室，耽于奢靡。无亲生嗣子，临终托孤司马懿、曹爽于八岁养子曹芳，埋下司马氏专权之祸。",
    "events": [],
    "artifacts": [],
    "wikidata": null,
    "sources": [{"title": "三国志·魏书·明帝纪", "type": "primary", "ref": "卷三"}],
    "_meta": {"created_by": "ai-pipeline", "model": "kimi-k3", "prompt_version": "weijin-v1", "version": 1}
  },
  {
    "id": "person.wei.caofang",
    "uuid": "fa696484-9e8d-4d4a-9dcd-8d1b082600c4",
    "name": "曹芳",
    "name_traditional": "曹芳",
    "titles": ["齐王", "邵陵县公"],
    "courtesy_name": "兰卿",
    "category": ["emperor"],
    "dynasty": "dynasty.wei",
    "birth": {"year": 232, "circa": false, "original": "太和六年生，明帝养子", "disputed": []},
    "death": {"year": 274, "circa": false, "original": "晋泰始十年薨", "disputed": []},
    "reign": {"start": 239, "end": 254, "note": "八岁即位；254年被司马师废为齐王"},
    "family": {"father": null, "mother": null, "spouses": [], "children": []},
    "predecessor": "person.wei.caorui",
    "successor": "person.wei.caomao",
    "bio": "魏明帝养子（宫省事秘，莫有知其所由来者）。八岁即位，曹爽、司马懿辅政。正始十年高平陵之变后司马氏专魏政。嘉平六年被司马师以郭太后令废为齐王，晋受禅后降封邵陵县公，得以善终。",
    "events": ["event.wei.gaopingling"],
    "artifacts": [],
    "wikidata": null,
    "sources": [{"title": "三国志·魏书·三少帝纪", "type": "primary", "ref": "卷四"}],
    "_meta": {"created_by": "ai-pipeline", "model": "kimi-k3", "prompt_version": "weijin-v1", "version": 1}
  },
  {
    "id": "person.wei.caomao",
    "uuid": "2daf77ea-1306-4397-b699-90e4b1274bce",
    "name": "曹髦",
    "name_traditional": "曹髦",
    "titles": ["高贵乡公"],
    "courtesy_name": "彦士",
    "category": ["emperor"],
    "dynasty": "dynasty.wei",
    "birth": {"year": 241, "circa": false, "original": "正始二年生，文帝之孙，东海定王曹霖之子", "disputed": []},
    "death": {"year": 260, "circa": false, "original": "甘露五年五月己丑，讨司马昭时为太子舍人成济所弑，年二十", "disputed": []},
    "reign": {"start": 254, "end": 260},
    "family": {"father": null, "mother": null, "spouses": [], "children": []},
    "predecessor": "person.wei.caofang",
    "successor": "person.wei.caohuan",
    "bio": "曹丕之孙。曹芳被废后由司马师迎立。不甘为傀儡，甘露五年召王经等曰「司马昭之心，路人所知也」，亲率僮仆数百鼓噪出宫讨司马昭，于南阙下被贾充指使的成济弑杀。死后以王礼葬，司马昭归罪成济夷其三族。",
    "events": [],
    "artifacts": [],
    "wikidata": null,
    "sources": [{"title": "三国志·魏书·三少帝纪", "type": "primary", "ref": "卷四"}],
    "_meta": {"created_by": "ai-pipeline", "model": "kimi-k3", "prompt_version": "weijin-v1", "version": 1}
  },
  {
    "id": "person.wei.caohuan",
    "uuid": "4c0c4eb8-2aaf-42a6-b5c8-0d515dcd84f1",
    "name": "曹奂",
    "name_traditional": "曹奐",
    "titles": ["魏元帝", "陈留王"],
    "courtesy_name": "景明",
    "category": ["emperor"],
    "dynasty": "dynasty.wei",
    "birth": {"year": 246, "circa": false, "original": "正始七年生，燕王曹宇之子", "disputed": []},
    "death": {"year": 302, "circa": false, "original": "晋太安元年薨，年五十八", "disputed": []},
    "reign": {"start": 260, "end": 266, "note": "咸熙二年十二月（公历266年2月）禅位于晋王司马炎"},
    "family": {"father": null, "mother": null, "spouses": [], "children": []},
    "predecessor": "person.wei.caomao",
    "successor": null,
    "bio": "本名曹璜，曹操之孙。曹髦被弑后由司马昭迎立。在位期间魏灭蜀汉（263年），然政归司马氏。咸熙二年禅位于司马炎，被封陈留王，食邑万户，得以善终，年五十八而薨，为末代君主中结局最佳者之一。",
    "events": [],
    "artifacts": [],
    "wikidata": null,
    "sources": [{"title": "三国志·魏书·三少帝纪", "type": "primary", "ref": "卷四"}],
    "_meta": {"created_by": "ai-pipeline", "model": "kimi-k3", "prompt_version": "weijin-v1", "version": 1}
  }
]
