[
  {
    "id": "person.liusong.liuyu",
    "uuid": "1ebdc293-bb9a-401e-9fe2-f8fd311e8235",
    "name": "刘裕",
    "name_traditional": "劉裕",
    "titles": ["宋武帝", "高祖武皇帝"],
    "courtesy_name": "德舆",
    "category": ["emperor"],
    "dynasty": "dynasty.liu-song",
    "birth": {"year": 363, "circa": false, "original": "兴宁元年三月壬寅夜生，彭城人，小名寄奴", "disputed": []},
    "death": {"year": 422, "circa": false, "original": "永初三年五月癸亥，崩于西殿，年六十", "disputed": []},
    "reign": {"start": 420, "end": 422, "note": "420年六月受晋恭帝禅"},
    "family": {"father": null, "mother": null, "spouses": [], "children": ["person.liusong.liuyifu", "person.liusong.liuyilong"]},
    "predecessor": "person.jin.simadewen",
    "successor": "person.liusong.liuyifu",
    "bio": "寒门出身的南朝第一帝。以贩履为业，投北府兵，破桓玄复晋室，灭南燕、后秦，却月阵破魏骑，两京光复。辛弃疾「金戈铁马，气吞万里如虎」即咏其北伐。受晋禅建宋，却开创了弑杀禅让君主的恶例。在位三年，厉行节俭，为南朝国力最盛之时。",
    "events": [],
    "artifacts": [],
    "wikidata": null,
    "sources": [{"title": "宋书·武帝纪", "type": "primary", "ref": "卷一至卷三"}],
    "_meta": {"created_by": "ai-pipeline", "model": "kimi-k3", "prompt_version": "weijin-v1", "version": 1}
  },
  {
    "id": "person.liusong.liuyifu",
    "uuid": "d0af4786-c4e3-4f82-9533-5386777dc309",
    "name": "刘义符",
    "name_traditional": "劉義符",
    "titles": ["宋少帝", "营阳王"],
    "courtesy_name": "车兵",
    "category": ["emperor"],
    "dynasty": "dynasty.liu-song",
    "birth": {"year": 406, "circa": false, "original": "义熙二年生，武帝长子", "disputed": []},
    "death": {"year": 424, "circa": false, "original": "景平二年六月被废为营阳王，旋被杀，年十九", "disputed": []},
    "reign": {"start": 422, "end": 424},
    "family": {"father": "person.liusong.liuyu", "mother": null, "spouses": [], "children": []},
    "predecessor": "person.liusong.liuyu",
    "successor": "person.liusong.liuyilong",
    "bio": "武帝长子。居丧无礼，游戏无度，与佞臣狎昵。顾命大臣徐羡之、傅亮、谢晦废其为营阳王并杀害，迎立宜都王刘义隆。然三人旋即为文帝所诛，废立者两败俱伤。",
    "events": [],
    "artifacts": [],
    "wikidata": null,
    "sources": [{"title": "宋书·少帝纪", "type": "primary", "ref": "卷四"}],
    "_meta": {"created_by": "ai-pipeline", "model": "kimi-k3", "prompt_version": "weijin-v1", "version": 1}
  },
  {
    "id": "person.liusong.liuyilong",
    "uuid": "27036f3f-e0e9-46d3-a4a6-0915c0ad1b05",
    "name": "刘义隆",
    "name_traditional": "劉義隆",
    "titles": ["宋文帝", "太祖文皇帝"],
    "courtesy_name": "车儿",
    "category": ["emperor"],
    "dynasty": "dynasty.liu-song",
    "birth": {"year": 407, "circa": false, "original": "义熙三年生，武帝第三子", "disputed": []},
    "death": {"year": 453, "circa": false, "original": "元嘉三十年二月甲子，被太子刘劭弑于含章殿，年四十七", "disputed": []},
    "reign": {"start": 424, "end": 453},
    "family": {"father": "person.liusong.liuyu", "mother": null, "spouses": [], "children": ["person.liusong.liushao", "person.liusong.liujun", "person.liusong.liuyu-ming"]},
    "predecessor": "person.liusong.liuyifu",
    "successor": "person.liusong.liushao",
    "bio": "在位三十年，诛徐羡之、傅亮、谢晦自收大权，息兵养民，史称「元嘉之治」，为南朝治世之最。然元嘉草草，三次北伐皆惨败，魏太武帝饮马长江。终因议废太子事泄，为太子刘劭所弑。「元嘉草草，封狼居胥，赢得仓皇北顾」即咏其事。",
    "events": [],
    "artifacts": [],
    "wikidata": null,
    "sources": [{"title": "宋书·文帝纪", "type": "primary", "ref": "卷五"}],
    "_meta": {"created_by": "ai-pipeline", "model": "kimi-k3", "prompt_version": "weijin-v1", "version": 1}
  },
  {
    "id": "person.liusong.liushao",
    "uuid": "a388e804-e4f5-4aa8-acbe-36653c77cd68",
    "name": "刘劭",
    "name_traditional": "劉劭",
    "titles": ["元凶劭"],
    "courtesy_name": "休远",
    "category": ["emperor"],
    "dynasty": "dynasty.liu-song",
    "birth": {"year": 426, "circa": false, "original": "元嘉三年生，文帝长子", "disputed": []},
    "death": {"year": 453, "circa": false, "original": "元嘉三十年五月，兵败被杀", "disputed": []},
    "reign": {"start": 453, "end": 453, "note": "弑父自立，在位约三个月"},
    "family": {"father": "person.liusong.liuyilong", "mother": null, "spouses": [], "children": []},
    "predecessor": "person.liusong.liuyilong",
    "successor": "person.liusong.liujun",
    "bio": "文帝嫡长子。行巫蛊咒父事发，文帝欲废之而未决，刘劭遂率东宫兵夜闯宫城，弑父自立，为南朝首位弑父者。武陵王刘骏起兵讨伐，台城陷落，刘劭被杀，史称「元凶劭」。",
    "events": [],
    "artifacts": [],
    "wikidata": null,
    "sources": [{"title": "宋书·二凶传", "type": "primary", "ref": "卷九十九"}],
    "_meta": {"created_by": "ai-pipeline", "model": "kimi-k3", "prompt_version": "weijin-v1", "version": 1}
  },
  {
    "id": "person.liusong.liujun",
    "uuid": "3d24fbea-7501-4f1e-8d16-2a686525e915",
    "name": "刘骏",
    "name_traditional": "劉駿",
    "titles": ["宋孝武帝", "世祖孝武皇帝"],
    "courtesy_name": "休龙",
    "category": ["emperor"],
    "dynasty": "dynasty.liu-song",
    "birth": {"year": 430, "circa": false, "original": "元嘉七年生，文帝第三子", "disputed": []},
    "death": {"year": 464, "circa": false, "original": "大明八年闰五月庚申，崩于玉烛殿，年三十五", "disputed": []},
    "reign": {"start": 453, "end": 464},
    "family": {"father": "person.liusong.liuyilong", "mother": null, "spouses": [], "children": ["person.liusong.liuziye"]},
    "predecessor": "person.liusong.liushao",
    "successor": "person.liusong.liuziye",
    "bio": "起兵讨灭弑父的刘劭而自立。在位期间加强皇权，设典签监控宗王，屡次诛杀宗室。然贪财好赌、淫乱无度，与母路太后之间秽声四布。死后长子刘子业即位，刘宋开始血亲相屠的恶性循环。",
    "events": [],
    "artifacts": [],
    "wikidata": null,
    "sources": [{"title": "宋书·孝武帝纪", "type": "primary", "ref": "卷六"}],
    "_meta": {"created_by": "ai-pipeline", "model": "kimi-k3", "prompt_version": "weijin-v1", "version": 1}
  },
  {
    "id": "person.liusong.liuziye",
    "uuid": "9d575892-e1e0-43d3-b609-8d053876f6da",
    "name": "刘子业",
    "name_traditional": "劉子業",
    "titles": ["宋前废帝"],
    "courtesy_name": "法师",
    "category": ["emperor"],
    "dynasty": "dynasty.liu-song",
    "birth": {"year": 449, "circa": false, "original": "元嘉二十六年正月甲子生，孝武帝长子", "disputed": []},
    "death": {"year": 466, "circa": false, "original": "景和元年十一月（公历466年1月1日），被寿寂之等弑于华林园，年十七", "disputed": []},
    "reign": {"start": 464, "end": 465},
    "family": {"father": "person.liusong.liujun", "mother": null, "spouses": [], "children": []},
    "predecessor": "person.liusong.liujun",
    "successor": "person.liusong.liuyu-ming",
    "bio": "南朝有名的狂暴少主。诛杀顾命大臣，幽辱诸叔（号湘东王彧为「猪王」），纳姑母新蔡公主，淫乱宫闱。在位十七个月，被寿寂之等刺杀于华林园竹林堂，时年十七，史称前废帝。",
    "events": [],
    "artifacts": [],
    "wikidata": null,
    "sources": [{"title": "宋书·前废帝纪", "type": "primary", "ref": "卷七"}],
    "_meta": {"created_by": "ai-pipeline", "model": "kimi-k3", "prompt_version": "weijin-v1", "version": 1}
  },
  {
    "id": "person.liusong.liuyu-ming",
    "uuid": "a2696bf3-5ee6-43c6-a26f-d7c80c07ca4d",
    "name": "刘彧",
    "name_traditional": "劉彧",
    "titles": ["宋明帝", "太宗明皇帝"],
    "courtesy_name": "休炳",
    "category": ["emperor"],
    "dynasty": "dynasty.liu-song",
    "birth": {"year": 439, "circa": false, "original": "元嘉十六年生，文帝第十一子", "disputed": []},
    "death": {"year": 472, "circa": false, "original": "泰豫元年四月己亥，崩于景福殿，年三十四", "disputed": []},
    "reign": {"start": 465, "end": 472, "note": "slug 加 -ming 以别于宋武帝刘裕"},
    "family": {"father": "person.liusong.liuyilong", "mother": null, "spouses": [], "children": ["person.liusong.liuyu-houfei", "person.liusong.liuzhun"]},
    "predecessor": "person.liusong.liuziye",
    "successor": "person.liusong.liuyu-houfei",
    "bio": "文帝第十一子，初封湘东王，被前废帝百般凌辱而佯痴自保。前废帝被弑后继位。在位期间猜忌宗室，大杀孝武帝诸子，又以阴鸷手段翦除功臣宿将，致淮北诸州尽陷于魏。猜忌杀戮使刘宋元气大伤。",
    "events": [],
    "artifacts": [],
    "wikidata": null,
    "sources": [{"title": "宋书·明帝纪", "type": "primary", "ref": "卷八"}],
    "_meta": {"created_by": "ai-pipeline", "model": "kimi-k3", "prompt_version": "weijin-v1", "version": 1}
  },
  {
    "id": "person.liusong.liuyu-houfei",
    "uuid": "8516cfee-90bd-4aa4-b9d0-d7012b2cb8a6",
    "name": "刘昱",
    "name_traditional": "劉昱",
    "titles": ["宋后废帝", "苍梧王"],
    "courtesy_name": "德融",
    "category": ["emperor"],
    "dynasty": "dynasty.liu-song",
    "birth": {"year": 463, "circa": false, "original": "大明七年正月辛丑生，明帝长子", "disputed": []},
    "death": {"year": 477, "circa": false, "original": "元徽五年七月戊子，被杨玉夫等弑于仁寿殿，年十五", "disputed": []},
    "reign": {"start": 472, "end": 477, "note": "slug 加 -houfei 以别于宋武帝刘裕、明帝刘彧"},
    "family": {"father": "person.liusong.liuyu-ming", "mother": null, "spouses": [], "children": []},
    "predecessor": "person.liusong.liuyu-ming",
    "successor": "person.liusong.liuzhun",
    "bio": "明帝长子，十岁即位。即位后微服出行，无日不出，以杀人取乐，尝欲以萧道成腹为箭靶射之。七夕夜被萧道成党羽杨玉夫刺杀于毡帐之中。死后萧道成立刘准，宋祚名存实亡。",
    "events": [],
    "artifacts": [],
    "wikidata": null,
    "sources": [{"title": "宋书·后废帝纪", "type": "primary", "ref": "卷九"}],
    "_meta": {"created_by": "ai-pipeline", "model": "kimi-k3", "prompt_version": "weijin-v1", "version": 1}
  },
  {
    "id": "person.liusong.liuzhun",
    "uuid": "f9f6db5e-cd95-45d6-a264-9fe08f96a36d",
    "name": "刘准",
    "name_traditional": "劉準",
    "titles": ["宋顺帝", "汝阴王"],
    "courtesy_name": "仲谋",
    "category": ["emperor"],
    "dynasty": "dynasty.liu-song",
    "birth": {"year": 467, "circa": false, "original": "泰始五年七月癸丑生，明帝第三子", "disputed": []},
    "death": {"year": 479, "circa": false, "original": "南齐建元元年五月己未，被杀，年十三", "disputed": []},
    "reign": {"start": 477, "end": 479},
    "family": {"father": "person.liusong.liuyu-ming", "mother": null, "spouses": [], "children": []},
    "predecessor": "person.liusong.liuyu-houfei",
    "successor": "person.sqi.xiaodaocheng",
    "bio": "刘宋末代皇帝。萧道成弑后废帝后立之，朝政尽归萧氏。升明三年被迫禅位，出宫时涕泣而曰「愿后身世世勿复生天王家」。封汝阴王，次月即被杀，刘宋宗室亦被萧道成诛戮殆尽。",
    "events": [],
    "artifacts": [],
    "wikidata": null,
    "sources": [{"title": "宋书·顺帝纪", "type": "primary", "ref": "卷十"}],
    "_meta": {"created_by": "ai-pipeline", "model": "kimi-k3", "prompt_version": "weijin-v1", "version": 1}
  }
]
