[
  {
    "id": "person.shuhan.liubei",
    "uuid": "f0f5f38f-33f6-42f7-94a4-f12e7b9506e0",
    "name": "刘备",
    "name_traditional": "劉備",
    "titles": ["汉昭烈帝", "先主"],
    "courtesy_name": "玄德",
    "category": ["emperor"],
    "dynasty": "dynasty.shu-han",
    "birth": {"year": 161, "circa": false, "original": "延熹四年生，涿郡涿县人", "disputed": []},
    "death": {"year": 223, "circa": false, "original": "章武三年四月癸巳，殂于永安宫，年六十三", "disputed": []},
    "reign": {"start": 221, "end": 223, "note": "曹丕篡汉后于成都称帝，延续汉祚"},
    "family": {"father": null, "mother": null, "spouses": [], "children": ["person.shuhan.liushan"]},
    "predecessor": null,
    "successor": "person.shuhan.liushan",
    "bio": "蜀汉开国皇帝，自称中山靖王之后。少孤贫，织席贩履为业。汉末起兵，半生颠沛依公孙瓒、陶谦、曹操、袁绍、刘表，得诸葛亮后取荆州、益州、汉中，进位汉中王，221年称帝。为报关羽之仇倾国伐吴，夷陵大败，退守白帝城，托孤诸葛亮而殂。",
    "events": ["event.wei.chibi", "event.shuhan.yiling"],
    "artifacts": [],
    "wikidata": null,
    "sources": [{"title": "三国志·蜀书·先主传", "type": "primary", "ref": "卷三十二"}],
    "_meta": {"created_by": "ai-pipeline", "model": "kimi-k3", "prompt_version": "weijin-v1", "version": 1}
  },
  {
    "id": "person.shuhan.liushan",
    "uuid": "5f700429-f6dd-4acd-83bb-862846f08c27",
    "name": "刘禅",
    "name_traditional": "劉禪",
    "titles": ["汉后主", "安乐公", "孝怀皇帝（刘渊追谥）"],
    "courtesy_name": "公嗣",
    "category": ["emperor"],
    "dynasty": "dynasty.shu-han",
    "birth": {"year": 207, "circa": false, "original": "建安十二年生", "disputed": []},
    "death": {"year": 271, "circa": false, "original": "晋泰始七年薨于洛阳", "disputed": []},
    "reign": {"start": 223, "end": 263, "note": "在位四十一年，为三国君主中在位最久者"},
    "family": {"father": "person.shuhan.liubei", "mother": null, "spouses": [], "children": []},
    "predecessor": "person.shuhan.liubei",
    "successor": null,
    "bio": "刘备之子，小字阿斗。十七岁即位，政由诸葛亮、蒋琬、费祎相继主持；后期宠信宦官黄皓。景耀六年邓艾偷渡阴平，兵临成都即降，蜀汉亡。迁洛阳封安乐公，司马昭宴上以蜀伎乐试之，答曰「此间乐，不思蜀」，「乐不思蜀」遂为成语。",
    "events": [],
    "artifacts": [],
    "wikidata": null,
    "sources": [{"title": "三国志·蜀书·后主传", "type": "primary", "ref": "卷三十三"}],
    "_meta": {"created_by": "ai-pipeline", "model": "kimi-k3", "prompt_version": "weijin-v1", "version": 1}
  }
]
